id,title,score,num_comments,author,created_utc,url,over_18,edited,spoiler,stickied
1gppjqh,How SQLite made Notion 30% Faster,42,4,SnooMuffins9844,2024-11-12 17:03:20,https://www.reddit.com/r/dataengineering/comments/1gppjqh/how_sqlite_made_notion_30_faster/,False,False,False,False
1gpnvea,Is using spark.sql() less efficient than writing out pyspark transformations?,34,15,Reddit_Account_C-137,2024-11-12 15:53:51,https://www.reddit.com/r/dataengineering/comments/1gpnvea/is_using_sparksql_less_efficient_than_writing_out/,False,False,False,False
1gpj6zd,So I Have A Data Product... Now What?,31,3,growth_man,2024-11-12 12:06:10,https://moderndata101.substack.com/p/so-i-have-a-data-product-now-what,False,False,False,False
1gpf05x,Fundamental of Data Engineering,29,11,WildAd9880,2024-11-12 07:00:10,https://www.reddit.com/r/dataengineering/comments/1gpf05x/fundamental_of_data_engineering/,False,False,False,False
1gpd4e3,Tools/course to buy this Black Friday,21,10,rockingpj,2024-11-12 04:57:55,https://www.reddit.com/r/dataengineering/comments/1gpd4e3/toolscourse_to_buy_this_black_friday/,False,False,False,False
1gptjn6,Spark for processing a billion rows in a SQL table,11,24,qwerty-yul,2024-11-12 19:45:51,https://www.reddit.com/r/dataengineering/comments/1gptjn6/spark_for_processing_a_billion_rows_in_a_sql_table/,False,False,False,False
1gpkopq,Possible options to speed-up ElasticSearch performance,6,11,SAsad01,2024-11-12 13:27:18,https://www.reddit.com/r/dataengineering/comments/1gpkopq/possible_options_to_speedup_elasticsearch/,False,False,False,False
1gpi2no,Topics for Data Engineering,7,3,cant_figure_it,2024-11-12 10:53:07,https://www.reddit.com/r/dataengineering/comments/1gpi2no/topics_for_data_engineering/,False,False,False,False
1gpf92s,For those who create diagrams using a DSL - what has your experience been like?,6,11,BigBootyBear,2024-11-12 07:18:35,https://www.reddit.com/r/dataengineering/comments/1gpf92s/for_those_who_create_diagrams_using_a_dsl_what/,False,False,False,False
1gpfv0r,[Blog] Data Quality - Metrics for Table Extraction,6,0,hiitkid,2024-11-12 08:04:10,https://www.reddit.com/r/dataengineering/comments/1gpfv0r/blog_data_quality_metrics_for_table_extraction/,False,False,False,False
1gpdpsv,AWS certification,7,1,workhardplayhardder,2024-11-12 05:32:41,https://www.reddit.com/r/dataengineering/comments/1gpdpsv/aws_certification/,False,False,False,False
1gpvfao,Pipeline design for analyzing discovery docs in court cases,3,2,makelefani,2024-11-12 21:03:14,https://www.reddit.com/r/dataengineering/comments/1gpvfao/pipeline_design_for_analyzing_discovery_docs_in/,False,False,False,False
1gpmiot,Which tool is better IBM Datastage or Sailpoint? I am looking for a career change,2,3,JestinPJiji,2024-11-12 14:54:57,https://www.reddit.com/r/dataengineering/comments/1gpmiot/which_tool_is_better_ibm_datastage_or_sailpoint_i/,False,False,False,False
1gpmia0,Handle Flink or Spark at Scale,2,3,abhi5025,2024-11-12 14:54:26,https://www.reddit.com/r/dataengineering/comments/1gpmia0/handle_flink_or_spark_at_scale/,False,False,False,False
1gpe4bk,Dataproc - SAP ECC (AWS),2,3,Optimal_You_5483,2024-11-12 05:59:01,https://www.reddit.com/r/dataengineering/comments/1gpe4bk/dataproc_sap_ecc_aws/,False,False,False,False
1gpxcfm,Serverless costs for Databricks,1,2,SaasMan87,2024-11-12 22:24:22,https://www.reddit.com/r/dataengineering/comments/1gpxcfm/serverless_costs_for_databricks/,False,False,False,False
1gpvyv8,Need help regarding the project explanation to the interviewer,0,0,Additional_Town183,2024-11-12 21:25:46,https://www.reddit.com/r/dataengineering/comments/1gpvyv8/need_help_regarding_the_project_explanation_to/,False,False,False,False
1gpq7k0,Need help opening a massive .dbo (45GB) — any advice?,1,7,alb53,2024-11-12 17:30:19,https://www.reddit.com/r/dataengineering/comments/1gpq7k0/need_help_opening_a_massive_dbo_45gb_any_advice/,False,False,False,False
1gpoap4,Municipal Government De-Siloing. Help with creating an asset database.,1,8,AscendingAgain,2024-11-12 16:12:05,https://www.reddit.com/r/dataengineering/comments/1gpoap4/municipal_government_desiloing_help_with_creating/,False,False,False,False
1gpnfac,Cost-Effective Airbyte Pipelines,1,5,Nessjk,2024-11-12 15:34:35,https://www.reddit.com/r/dataengineering/comments/1gpnfac/costeffective_airbyte_pipelines/,False,False,False,False
1gpgvyq,"[Meetup] Functional World #12 | How to handle things in your project without DevOps around?
",1,1,ComprehensiveSell578,2024-11-12 09:23:57,https://www.reddit.com/r/dataengineering/comments/1gpgvyq/meetup_functional_world_12_how_to_handle_things/,False,False,False,False
1gp7da8,Is it possible for the BashOperator to access files saved in a directory by a PythonOperator?,1,7,skrillavilla,2024-11-12 00:03:57,https://www.reddit.com/r/dataengineering/comments/1gp7da8/is_it_possible_for_the_bashoperator_to_access/,False,False,False,False
1gpiep9,Delivery Solution Architect vs Data Engineer,0,7,triesegment,2024-11-12 11:15:50,https://www.reddit.com/r/dataengineering/comments/1gpiep9/delivery_solution_architect_vs_data_engineer/,False,False,False,False
1gp7eng,How to Provide Ad-Hoc Real-Time Access to Data from Diverse Systems with No-Code Options? GraphQL vs Data virtualization vs Data Lakes,0,8,SnooDoughnuts3172,2024-11-12 00:05:48,https://www.reddit.com/r/dataengineering/comments/1gp7eng/how_to_provide_adhoc_realtime_access_to_data_from/,False,False,False,False
1gpwwwv,Seeking data engineer roles,0,6,Square-Lie1216,2024-11-12 22:05:45,https://www.reddit.com/r/dataengineering/comments/1gpwwwv/seeking_data_engineer_roles/,False,False,False,False
1gpiaik,Learn KQL with Kusto Detective Agency,0,0,TybulOnAzure,2024-11-12 11:07:40,https://www.reddit.com/r/dataengineering/comments/1gpiaik/learn_kql_with_kusto_detective_agency/,False,False,False,False
1gplp7i,As a fresher who is preparing for DE jobs should I consider learning Scala ,0,16,perfektenschlagggg,2024-11-12 14:16:53,https://www.reddit.com/r/dataengineering/comments/1gplp7i/as_a_fresher_who_is_preparing_for_de_jobs_should/,False,False,False,False
1gpf62k,Desperately need your help! Just 5 minutes of your time! 🙏,0,0,sssilicium,2024-11-12 07:12:08,https://www.reddit.com/r/dataengineering/comments/1gpf62k/desperately_need_your_help_just_5_minutes_of_your/,False,False,False,False
